{
  "schema_version": "unirouter.provider-pack.v1",
  "pack_id": "unirouter.openai.core",
  "pack_version": "1.0.0",
  "provider": "openai",
  "adapter_type": "openai_compatible",
  "conformance_level": "fixture_verified",
  "network_verified": false,
  "endpoints": [
    "/v1/chat/completions",
    "/v1/embeddings"
  ],
  "modalities": [
    "text",
    "embeddings"
  ],
  "auth_profiles": [
    {
      "type": "bearer",
      "wire_header": "Authorization"
    }
  ],
  "usage_profile": {
    "authority_when_complete": "provider_reported",
    "missing_behavior": "missing_not_zero",
    "cache_classes": []
  },
  "error_profile": {
    "classifier": "unirouter.http-failure.v1",
    "unknown_behavior": "unknown_not_retryable_without_status_evidence"
  },
  "fixtures": [
    {
      "fixture_id": "openai-chat-success.v1",
      "path": "fixtures/openai-chat-success.v1.json",
      "sha256": "sha256:6b95c320fb75b9e74e30dc2a5e07a282ad83e20329a19e4271d8fb79ac87a861"
    },
    {
      "fixture_id": "openai-embeddings-success.v1",
      "path": "fixtures/openai-embeddings-success.v1.json",
      "sha256": "sha256:5ba8db14c310d1ca60e953dc27806e2b71ea5dcaee3210b3ecd5849dc9d6b150"
    }
  ]
}
