{
  "schema_version": "unirouter.provider-pack.v1",
  "pack_id": "unirouter.anthropic.core",
  "pack_version": "1.0.0",
  "provider": "anthropic",
  "adapter_type": "anthropic_native",
  "conformance_level": "fixture_verified",
  "network_verified": false,
  "endpoints": [
    "/v1/chat/completions"
  ],
  "modalities": [
    "text"
  ],
  "auth_profiles": [
    {
      "type": "api_key",
      "wire_header": "x-api-key"
    }
  ],
  "usage_profile": {
    "authority_when_complete": "provider_reported",
    "missing_behavior": "missing_not_zero",
    "cache_classes": []
  },
  "error_profile": {
    "classifier": "unirouter.http-failure.v1",
    "unknown_behavior": "unknown_not_retryable_without_status_evidence"
  },
  "fixtures": [
    {
      "fixture_id": "anthropic-chat-success.v1",
      "path": "fixtures/anthropic-chat-success.v1.json",
      "sha256": "sha256:34a12e76ec3d77259c91cf8d7a7486f976ed0d0fbc925f82093da7669da5da6e"
    }
  ]
}
